Sheet: Cross-sectional reports
B1: National Care and Treatment Programme
B2: Quarterly facility-based HIV care/ART reporting form
C4: Reporting period: | E4: Date of completion of form (dd/mm/yyyy): 23-Mar-2009
C6: Facility name: | E6: ( ) Public ( ) Private ( ) FBO ( ) Other (specify) _________________________
C8: District: | E8: Region:
C10: Name of person reporting:
C11: Name of the person checking the report: Date:
C13: 3. Current on ART at the end of the quarter
C14: On 1st-line ARV regimen
C15: 1. Males (>14 years) | E15: 8
C16: 2. Females (>14 years) | E16: 1
C17: 3. Males (0-14 years) | E17: 6
C18: 4. Females (0-14 years) | E18: 1
C19: Total adults and children on 1st-line regimens | E19: =SUM(R[-4]C:R[-3]C:R[-2]C:R[-1]C) -> 16
C20: On 2nd-line ARV regimen
C21: 1. Males (>14 years) | E21: 0
C22: 2. Females (>14 years) | E22: 0
C23: 3. Males (0-14 years) | E23: 0
C24: 4. Females (0-14 years) | E24: 0
C25: Total adults and children on 1st and 2nd-line regimens | E25: =SUM(R[-10]C:R[-9]C,R[-4]C:R[-3]C) -> 9
C27: Total adults and children on 1st and 2nd-line regimens | E27: =SUM(R[-10]C:R[-9]C,R[-4]C:R[-3]C) -> 7
C29: Total unspecified age or sex | E29: 0
C30: Current on ART at the end of the quarter | E30: =SUM(R[-5]C,R[-3]C) -> 16
C33: 4. Patients who received HIV care during the reporting period (and subset of those who received Diflucan)
D34: Non-ART patients who received care during the quarter (seen in the quarter) minus start ART (from pre-ART register) | E34: Patients current in ART at the end of the quarter (from Table 3) | F34: Total patients who received care (non-ART and ART) during the quarter
C35: 1. Males (>14 years) | D35: 7 | E35: =SUM(R[-20]C,R[-14]C) -> 8 | F35: =SUM(RC[-2],RC[-1]) -> 15
C36: 2. Females (>14 years) | D36: 3 | E36: =SUM(R[-20]C,R[-14]C) -> 1 | F36: =SUM(RC[-2],RC[-1]) -> 4
C37: 3. Males (0-14 years) | D37: 6 | E37: =SUM(R[-20]C,R[-14]C) -> 6 | F37: =SUM(RC[-2],RC[-1]) -> 12
C38: 4. Females (0-14 years) | D38: 1 | E38: =SUM(R[-20]C,R[-14]C) -> 1 | F38: =SUM(RC[-2],RC[-1]) -> 2
C39: Total | D39: =SUM(R[-4]C,R[-3]C,R[-2]C,R[-1]C) -> 17 | E39: =SUM(R[-4]C,R[-3]C,R[-2]C,R[-1]C) -> 16 | F39: =SUM(RC[-2],RC[-1]) -> 33
C40: Subset of total:
C41: 5. Number on Diflucan during the last quarter | D41: 1 | E41: 3 | F41: =SUM(RC[-2],RC[-1]) -> 4
B47: Page 2/2

Sheet: tools
A1: Calculation tools for use at facility only
A3: 5.1 Number of persons who did not pick up their ARV regimens | B3: Male | C3: Female
A4: 1. For previous 1 month (only) | B4: a. | C4: e.
A5: 2. For previous 2 months (only) | B5: b. | C5: f.
A6: 3. For previous 3 or more months | B6: c. | C6: g.
A7: Subtotal | B7: d. | C7: h.
A8: Total number of persons who did not pick up their ART regimens | C8: i.
A11: 4. Patients who received HIV care during the reporting period (and subset of those who received TB Rx, INH and cotrimoxazole
B12: Non-ART patients who received care during the reporting period (received care - start ART from pre-ART register) | C12: ART patients who received care during the reporting period (from Table 3) | D12: Total patients who received care (non-ART and ART) during the reporting period
A13: 1. Males (>14 years) | B13: a. | C13: f. (3a.+ 3f.) | D13: k.
A14: 2. Females (>14 years) | B14: b. | C14: g. (3b. +3g.) | D14: l.
A15: 3. Males (0-14 years) | B15: c. | C15: h. (3c.+3h.) | D15: m.
A16: 4. Females (0-14 years) | B16: d. | C16: i. ( 3 d.+ 3i.) | D16: n.
A17: Total | B17: e. | C17: j. (3 e. + 3j.) | D17: o.
A18: Subset of total (every 6 months):
A19: Number on TB Rx | B19: p. | C19: s. | D19: v.
A20: Number on INH | B20: q. | C20: t. | D20: w.
A21: Number on cotrimoxazole | B21: r. | C21: u. | D21: x.

Sheet: cohort report 
B1: National Care and Treatment Programme Cohort analysis form
B3: Report on treatment status/outcomes for cohorts on ART | I3: ART start-up groups (cohorts) are defined by month/year they started ART.
B5: Facility: _________________________________ District: ___________________________________________
C7: For cohort starting ART by month/year: at baseline then results at 6 months on ART, 12 months on ART, 24 months on ART | D7: Cohort Jan06 | E7: 6 mo- July06 | F7: 12 mo- Jan07 | G7: 24 mo- Jan08 | H7: Cohort Feb06 | I7: 6 mo- Aug06 | J7: 12 mo- Feb07 | K7: 24 mo- Feb08 | L7: Cohort Mar06 | M7: 6 mo- Sep06 | N7: 12 mo- Mar07 | O7: 24 mo- Mar08 | P7: Cohort Apr06 | Q7: 6 mo- Oct06 | R7: 12 mo- Apr07 | S7: 24 mo- Apr08 | T7: Cohort May06 | U7: 6 mo- Nov06 | V7: 12 mo- May07 | W7: 24 mo- May08 | X7: Cohort Jun06 | Y7: 6 mo- Dec06 | Z7: 12 mo- Jun07 | AA7: 24 mo- Jun08
B8: G | C8: Started on ART in this clinic- original cohort
B9: TI | C9: Transfers in Add + | D9: x | H9: x | L9: x | P9: x | T9: x | X9: x
B10: TO | C10: Transfers out Subtract - | D10: x | H10: x | L10: x | P10: x | T10: x | X10: x
B11: N | C11: Net current cohort
B12: H | C12: On original 1st-line regimen
B13: I | C13: On alternate 1st-line regimen (substituted)
B14: J | C14: On 2nd-line or other regimen (switched)
C15: Stopped
C16: Died
C17: Lost to follow-up
C18: Percent of cohort alive and on ART
C19: [ (H + I + J) / N * 100 ]
C20: CD4 median or fraction 200 [of those with available CD4] (optional)
C21: Functional status
C22: Number Working
C23: Number Ambulatory
C24: Number Bedridden
C25: Total W+A+B
C26: Number of persons who picked up ARVs each month for 6 months | D26: x | F26: x | G26: x | H26: x | J26: x | K26: x | L26: x | N26: x | O26: x | P26: x | R26: x | S26: x | T26: x | V26: x | W26: x | X26: x | Z26: x | AA26: x
C27: Number of persons who picked up ARVs each month for 12 months | D27: x | E27: x | G27: x | H27: x | I27: x | K27: x | L27: x | M27: x | O27: x | P27: x | Q27: x | S27: x | T27: x | U27: x | W27: x | X27: x | Y27: x | AA27: x
C30: For cohort starting ART by month/year: at baseline then results at 6 months on ART, 12 months on ART, 24 months on ART | D30: Cohort Jul06 | E30: 6 mo- Jan07 | F30: 12 mo- Jul07 | G30: 24 mo- Jul08 | H30: Cohort Aug06 | I30: 6 mo- Feb07 | J30: 12 mo- Aug08 | K30: 24 mo- Aug08 | L30: Cohort Sep06 | M30: 6 mo- Mar07 | N30: 12 mo- Sep07 | O30: 24 mo- Sep08 | P30: Cohort Oct06 | Q30: 6 mo- Apr07 | R30: 12 mo- Oct07 | S30: 24 mo- Oct08 | T30: Cohort Nov06 | U30: 6 mo- May07 | V30: 12 mo- Nov07 | W30: 24 mo- Nov08 | X30: Cohort Dec06 | Y30: 6 mo- Jun07 | Z30: 12 mo- Dec07 | AA30: 24 mo- Dec08
B31: G | C31: Started on ART in this clinic- original cohort
B32: TI | C32: Transfers in Add + | D32: x | H32: x | L32: x | P32: x | T32: x | X32: x
B33: TO | C33: Transfers out Subtract - | D33: x | H33: x | L33: x | P33: x | T33: x | X33: x
B34: N | C34: Net current cohort
B35: H | C35: On original 1st-line regimen
B36: I | C36: On alternate 1st-line regimen (substituted)
B37: J | C37: On 2nd-line or other regimen (switched)
C38: Stopped
C39: Died
C40: Lost to follow-up
C41: Percent of cohort alive and on ART
C42: [ (H + I + J) / N * 100 ]
C43: CD4 median or proportion 200 [of those with available CD4] (optional)
C44: Functional status
C45: Number Working
C46: Number Ambulatory
C47: Number Bedridden
C48: Total W+A+B
C49: Number of persons who picked up ARVs each month for 6 months | D49: x | F49: x | G49: x | H49: x | J49: x | K49: x | L49: x | N49: x | O49: x | P49: x | R49: x | S49: x | T49: x | V49: x | W49: x | X49: x | Z49: x | AA49: x
C50: Number of persons who picked up ARVs each month for 12 months | D50: x | E50: x | G50: x | H50: x | I50: x | K50: x | L50: x | M50: x | O50: x | P50: x | Q50: x | S50: x | T50: x | U50: x | W50: x | X50: x | Y50: x | AA50: x

Sheet: Tally tools
B2: Reporting month:___________________
B3: Tally tool for eligible but not yet started on ART (to be kept by pre-ART register and updated with each encounter
C5: Tally of patients who have become newly eligible in the reporting month | D5: Tally of patients who were eligible in last reporting month and since started ART, died, transferred out or been lost to follow-up | E5: Totals
B6: Males > 14
B7: Females > 14
B8: Males 0-14
B9: Females 0-14
B10: Totals
B13: Tally tool for persons on ART who transferred into facility (to be kept by ART register and updated with each new Transfer In patient)
C15: Tally of patients who transfer in during the reporting month
B17: 2006-01-01T00:00:00.000 | C17: 2006-02-01T00:00:00.000 | D17: 2006-03-01T00:00:00.000 | E17: 2006-04-01T00:00:00.000 | F17: 2006-05-01T00:00:00.000 | G17: 2006-06-01T00:00:00.000
B19: 2006-07-01T00:00:00.000 | C19: 2006-08-01T00:00:00.000 | D19: 2006-09-01T00:00:00.000 | E19: 2006-10-01T00:00:00.000 | F19: 2006-11-01T00:00:00.000 | G19: 2006-12-01T00:00:00.000
B24: Tally tool for compiling cohort analysis reports from multiple ART register pages
B26: Cohort: Year ______ Month ___________
B27: Baseline | C27: Month 6 12 24 36 48 60 72 (circle appropriate month outcome)
B29: DATA ELEMENT | E29: TALLY
B30: (G) Started on ART in this clinic- original cohort
B31: (H) On original 1st-line regimen
B32: CD4 counts >= 200
B33: CD4 counts available
B34: Functional status
B35: Number Working
B36: Number Ambulatory
B37: Number Bedridden
B40: Cohort: Year ______ Month ___________
B41: Month 6 12 24 36 48 60 72 (circle appropriate month outcome)
B43: DATA ELEMENT | E43: TALLY
B44: (G) Started on ART in this clinic- original cohort
B45: (TI) Transfer In
B46: (TO) Transfer Out
B47: (H) On original 1st-line regimen
B48: (I) Substitution
B49: (J) Switch
B50: CD4 counts >= 200
B51: CD4 counts available
B52: Functional status
B53: Number Working
B54: Number Ambulatory
B55: Number Bedridden
B56: Number picked up 6/6 months
B57: Number picked up 12/12 months

Sheet: appt_bk
B2: Sample appointment book
B4: August 5, 2006*
B6: Unique CTC ID Number | C6: Health Facility File Number | D6: Name: First, Middle Last | F6: Reason for patient visit | G6: Patient show (Y/N)
A7: 1
A8: 2
A9: 3
A10: 4
A11: 5
B12: *Each page in the Appointment book is for one day of the year. The example shown is for August 5, 2006. All patients scheduled to come to the CTC on August 5, 2006 will be recorded on this page. A dark line can be drawn the morning of that day, and patients who come in that day, unscheduled, or without appointments can subsequently be entered beneath the line.

Sheet: reporting calendar
A1: Report submission calendar
A2: Report | C2: Jan | D2: Feb | E2: Mar | F2: Apr | G2: May | H2: Jun | I2: Jul | J2: Aug | K2: Sep | L2: Oct | M2: Nov | N2: Dec
A3: Cross-sectional | B3: Monthly Tables 1 and 2 | C3: x | D3: x | E3: x | F3: x | G3: x | H3: x | I3: x | J3: x | K3: x | L3: x | M3: x | N3: x
B4: Quarterly Tables 3 and 4 | C4: x | F4: x | I4: x | L4: x
A5: Cohort analysis | C5: x, * | D5: * | E5: * | F5: * | G5: * | H5: * | I5: x, * | J5: * | K5: * | L5: * | M5: * | N5: *
B8: x= report submitted to district coordinator
B9: *= update at facility